{
  "blockers": {
    "constitutional": [],
    "policy": [],
    "tooling": []
  },
  "debt": {
    "global_debt_items": [
      {
        "debt_id": "b0b03cf0b626d82378182dd7d8e76374c6b64b00c8c5be9cb994c872a459cd85",
        "line_number": 25,
        "repo": "inversion-next",
        "source_file": "docs/govos/_reports/CONVERGENCE_LOG.md",
        "text": "- `docs/codex-kernel/docs/50_INTEGRATION_RULES.md`: strong STATUS/REPORT/DEBT/NEXT semantics, but broader integrator law and less factory-runtime-specific"
      },
      {
        "debt_id": "c28d3261422be64c3f88808ee99232efb58cf695fe048dbc1c5cc0b0e98bd405",
        "line_number": 25,
        "repo": "hitech-frontend",
        "source_file": "docs/govos/_reports/CONVERGENCE_LOG.md",
        "text": "- `docs/codex-kernel/docs/50_INTEGRATION_RULES.md`: strong STATUS/REPORT/DEBT/NEXT semantics, but broader integrator law and less factory-runtime-specific"
      },
      {
        "debt_id": "ca663a89324411184847f9c0b4e29342ae9c961dcf2839d4cc72a1cd1265ee4a",
        "line_number": 25,
        "repo": "hitech-os",
        "source_file": "docs/govos/_reports/CONVERGENCE_LOG.md",
        "text": "- `docs/codex-kernel/docs/50_INTEGRATION_RULES.md`: strong STATUS/REPORT/DEBT/NEXT semantics, but broader integrator law and less factory-runtime-specific"
      }
    ],
    "totals": {
      "global_total": 3,
      "hitech-frontend": 1,
      "hitech-os": 1,
      "inversion-next": 1
    }
  },
  "determinism": {
    "inputs_hash": "769a5f1994180cdf2014688279819b511c03f3c5533f4794c9f0390145ec41a8",
    "outputs_hash": "c0ac120332ad4dd2a1843063d1352757f1180393b741cdaa708dec0d35d5fb99",
    "stable_sort_rules": [
      "repos sorted by name ascending",
      "blockers sorted by (repo, type, message)",
      "debt items sorted by debt_id ascending",
      "json keys sorted lexicographically",
      "meta report table rows sorted by repo name ascending"
    ]
  },
  "federation": {
    "run_id": "RUN_20260226_182007",
    "status": "OK",
    "summary_counts": {
      "blocked_total": 0,
      "degraded_total": 0,
      "missing_tooling_total": 0,
      "offline_total": 0,
      "ok_total": 3,
      "online_total": 3,
      "repos_total": 3
    },
    "timestamp_iso": "2026-02-26T18:20:07-06:00",
    "timezone": "America/Mexico_City"
  },
  "next_actions": {
    "immediate": [],
    "suggested": []
  },
  "repos": [
    {
      "blockers": {
        "constitutional": [],
        "policy": [],
        "tooling": []
      },
      "debt_items": [
        {
          "debt_id": "c28d3261422be64c3f88808ee99232efb58cf695fe048dbc1c5cc0b0e98bd405",
          "line_number": 25,
          "repo": "hitech-frontend",
          "source_file": "docs/govos/_reports/CONVERGENCE_LOG.md",
          "text": "- `docs/codex-kernel/docs/50_INTEGRATION_RULES.md`: strong STATUS/REPORT/DEBT/NEXT semantics, but broader integrator law and less factory-runtime-specific"
        }
      ],
      "docs_doctor": {
        "canonical_docs_root": "docs/govos",
        "check_ran": false,
        "present": true,
        "report_path": "F:/OneDrive/Hitech/3.Proyectos/CHAT GPT AI Estudio/HITECH_AISTUDIO_SYSTEM/0.Origins/app/frontend/hitech-frontend/docs/govos/_reports/FINAL_REPORT.md",
        "result": "OK"
      },
      "last_report_excerpt": [
        "# FINAL REPORT",
        "",
        "RESULT: OK",
        "REPO_ROOT: F:/repos/hitech-os",
        "CANONICAL_DOCS_ROOT: docs/govos",
        "",
        "## Mandatory First Read",
        "",
        "- KERNEL_CONTEXT.md: present",
        "- docs/factory/FACTORY_RUNTIME_EXPLAINED.md: present",
        "- additive_only_trigger: false",
        "- resolution: pointer stub linked to docs/factory/CONTRACT.md"
      ],
      "mandatory_first_read": {
        "additive_only_trigger": false,
        "factory_runtime_present": true,
        "kernel_present": true,
        "resolution": "pointer stub linked to docs/factory/CONTRACT.md"
      },
      "name": "hitech-frontend",
      "online": true,
      "path": "F:/OneDrive/Hitech/3.Proyectos/CHAT GPT AI Estudio/HITECH_AISTUDIO_SYSTEM/0.Origins/app/frontend/hitech-frontend",
      "status": "OK"
    },
    {
      "blockers": {
        "constitutional": [],
        "policy": [],
        "tooling": []
      },
      "debt_items": [
        {
          "debt_id": "ca663a89324411184847f9c0b4e29342ae9c961dcf2839d4cc72a1cd1265ee4a",
          "line_number": 25,
          "repo": "hitech-os",
          "source_file": "docs/govos/_reports/CONVERGENCE_LOG.md",
          "text": "- `docs/codex-kernel/docs/50_INTEGRATION_RULES.md`: strong STATUS/REPORT/DEBT/NEXT semantics, but broader integrator law and less factory-runtime-specific"
        }
      ],
      "docs_doctor": {
        "canonical_docs_root": "docs/govos",
        "check_ran": false,
        "present": true,
        "report_path": "F:/repos/hitech-os/docs/govos/_reports/FINAL_REPORT.md",
        "result": "OK"
      },
      "last_report_excerpt": [
        "# FINAL REPORT",
        "",
        "RESULT: OK",
        "REPO_ROOT: F:/repos/hitech-os",
        "CANONICAL_DOCS_ROOT: docs/govos",
        "",
        "## Mandatory First Read",
        "",
        "- KERNEL_CONTEXT.md: present",
        "- docs/factory/FACTORY_RUNTIME_EXPLAINED.md: present",
        "- additive_only_trigger: false",
        "- resolution: pointer stub linked to docs/factory/CONTRACT.md"
      ],
      "mandatory_first_read": {
        "additive_only_trigger": false,
        "factory_runtime_present": true,
        "kernel_present": true,
        "resolution": "pointer stub linked to docs/factory/CONTRACT.md"
      },
      "name": "hitech-os",
      "online": true,
      "path": "F:/repos/hitech-os",
      "status": "OK"
    },
    {
      "blockers": {
        "constitutional": [],
        "policy": [],
        "tooling": []
      },
      "debt_items": [
        {
          "debt_id": "b0b03cf0b626d82378182dd7d8e76374c6b64b00c8c5be9cb994c872a459cd85",
          "line_number": 25,
          "repo": "inversion-next",
          "source_file": "docs/govos/_reports/CONVERGENCE_LOG.md",
          "text": "- `docs/codex-kernel/docs/50_INTEGRATION_RULES.md`: strong STATUS/REPORT/DEBT/NEXT semantics, but broader integrator law and less factory-runtime-specific"
        }
      ],
      "docs_doctor": {
        "canonical_docs_root": "docs/govos",
        "check_ran": false,
        "present": true,
        "report_path": "F:/repos/inversion-next/docs/govos/_reports/FINAL_REPORT.md",
        "result": "OK"
      },
      "last_report_excerpt": [
        "# FINAL REPORT",
        "",
        "RESULT: OK",
        "REPO_ROOT: F:/repos/hitech-os",
        "CANONICAL_DOCS_ROOT: docs/govos",
        "",
        "## Mandatory First Read",
        "",
        "- KERNEL_CONTEXT.md: present",
        "- docs/factory/FACTORY_RUNTIME_EXPLAINED.md: present",
        "- additive_only_trigger: false",
        "- resolution: pointer stub linked to docs/factory/CONTRACT.md"
      ],
      "mandatory_first_read": {
        "additive_only_trigger": false,
        "factory_runtime_present": true,
        "kernel_present": true,
        "resolution": "pointer stub linked to docs/factory/CONTRACT.md"
      },
      "name": "inversion-next",
      "online": true,
      "path": "F:/repos/inversion-next",
      "status": "OK"
    }
  ]
}
